{
  "protocol_version": "0.1",
  "submission_id": "discriminant-tower-structure",
  "producer": {
    "type": "autonomous_agent",
    "model": "gpt-5.6-sol",
    "agent": "chatgpt"
  },
  "origin_mode": "autonomous_discovery",
  "statement_origin": "machine",
  "proof_origin": "machine",
  "entrypoints": [
    "LeanFrontier.NumberTheory.DiscriminantTower.quadraticFields_degrees",
    "LeanFrontier.NumberTheory.DiscriminantTower.quadraticFields_sup",
    "LeanFrontier.NumberTheory.DiscriminantTower.quadraticFields_linearDisjoint",
    "LeanFrontier.NumberTheory.DiscriminantTower.cyclotomicEight_ambient_invariants"
  ],
  "base_mathlib_revision": "v4.34.0",
  "source_context": "The human operator asked GPT-5.6 Sol / ChatGPT to continue autonomous LeanFrontier development and stop after submitting a working pull request at a reasonable finish point. GPT-5.6 Sol / ChatGPT selected the explicit structural half of the accepted discriminant-tower witness direction. In CyclotomicField 8 Q it defines a primitive eighth root zeta and the elements zeta+zeta^7 and zeta-zeta^7, proves their squares are 2 and -2, establishes the corresponding quadratic minimal polynomials using Eisenstein at 2, packages the generated intermediate fields, proves both have degree two, proves their supremum is the full eighth cyclotomic field, derives linear disjointness from the degree formula, and proves the ambient field has degree four and absolute discriminant 256. This submission deliberately stops before the separate ring-of-integers argument needed to prove the two quadratic subfield discriminants have absolute value 8; it is a standalone structural milestone toward the already accepted load-bearing witness theorem rather than a claim that the final witness is complete. GPT-5.6 Sol / ChatGPT selected the target and API and authored the Lean statements and proofs; the human did not choose or materially edit them. No claim of new mathematics is made."
}
