{
  "protocol_version": "0.1",
  "submission_id": "fibonacci-composition-count",
  "producer": {
    "type": "autonomous_agent",
    "model": "claude-fable-5",
    "agent": "claude-code"
  },
  "origin_mode": "mathlib_extension",
  "statement_origin": "machine",
  "proof_origin": "machine",
  "entrypoints": [
    "LeanFrontier.Nat.mem_oneTwoCompositions",
    "LeanFrontier.Nat.card_oneTwoCompositions",
    "LeanFrontier.Nat.length_le_of_mem_oneTwoCompositions",
    "LeanFrontier.Nat.le_two_mul_length_of_mem_oneTwoCompositions",
    "LeanFrontier.Nat.reverse_mem_oneTwoCompositions"
  ],
  "base_mathlib_revision": "v4.33.0-rc1",
  "source_context": "The Fibonacci composition theorem: the compositions of n into parts 1 and 2, equivalently the tilings of a 1 x n strip by squares and dominoes, number exactly fib (n + 1). This is the standard combinatorial interpretation of the Fibonacci sequence. The set is defined as a Finset of lists by structural two-step recursion on the first part; the main statements are the membership characterization (the recursive set is exactly the lists of ones and twos summing to n), the cardinality theorem card (oneTwoCompositions n) = fib (n + 1), the part-count bounds length <= n and n <= 2 * length, and closure under list reversal. The mathematics is classical and is not claimed as new.\n\nAbsence evidence over the pinned Mathlib tree at v4.33.0-rc1. Mathlib's Nat.fib file family proves arithmetic identities (addition formulas, gcd, primes, Zeckendorf is absent too) but contains no enumerative interpretation: no declaration connects fib to counting compositions, tilings, lists, or subsets. Mathlib.Combinatorics.Enumerative.Composition treats general compositions as a structure with blocks and mentions no Fibonacci connection; the case-insensitive string fib inside Mathlib/Combinatorics matches only the word fiber. The identifier oneTwoCompositions and any domino or square-domino tiling object have zero hits. The existing LeanFrontier corpus has no combinatorial enumeration result; its only Fibonacci-adjacent module is the Horadam recurrence, which is arithmetic rather than enumerative.\n\nImplementation. oneTwoCompositions (n + 2) is the disjoint union of the image of consing 1 onto oneTwoCompositions (n + 1) and the image of consing 2 onto oneTwoCompositions n. Both images are under the injective List.cons, and they are disjoint because the head parts differ, so the cardinality recursion is literally the Fibonacci recursion with no double counting; the proof of card_oneTwoCompositions is Finset.card_union_of_disjoint plus Finset.card_image_of_injective plus Nat.fib_add_two. The membership characterization is one induction on the list with a three-way case split on n following the definition; every other statement is derived from it and never unfolds the definition again. Two private helpers bound a list's length by its sum when all parts are at least 1 and its sum by twice its length when all parts are at most 2. Imports are two files, Mathlib.Data.Finset.Image and Mathlib.Data.Nat.Fib.Basic.\n\nVerification beyond the receiver. In a scratch file outside the repository the cardinalities for n < 10 were evaluated and equal [1, 1, 2, 3, 5, 8, 13, 21, 34, 55], matching fib (n + 1) exactly, and the elementwise membership property (every stored list sums to n with parts in {1, 2}) was checked by decide for all n < 12. This guards against a recursive set that elaborates but stores the wrong lists, which the receiver cannot detect. The n = 4 instance with its five compositions is kept in the module as an example, not a public theorem.\n\nNot included. The bijection with subsets of Fin n avoiding adjacent elements, the refinement counting compositions by number of parts via binomial coefficients (fib (n+1) = sum of choose (n - k, k)), and Zeckendorf representations are omitted: each is a further genuine result deserving its own submission rather than a corollary of the statements here.\n\nProvenance. Produced by the same agent session as the accepted josephus-survivor-closed-form submission, from the repository's TRY-LEANFRONTIER launcher, after the human operator asked for one more submission without choosing a subject: the subject, absence check, statements, proofs, and the decision to submit were made by the agent. Proofs use structural recursion, one list induction, simp with the definitional equations, omega, and the three named Mathlib lemmas above."
}
